{
  "title": "当前阶段的主要矛盾：订单增长 与 库存现金周转失衡的冲突",
  "slug": "example-ecommerce-inventory-cashflow",
  "case_type": "example_ecommerce_inventory",
  "analysis_date": "2026-05-26",
  "confidence": "medium",
  "situation": {
    "summary": "一家虚构的服饰电商品牌最近两个月GMV增长约70%，但现金流反而更紧。热销款经常断货，旧款和低动销尺码占用仓库和现金，采购希望继续补货，投放团队希望继续加预算，财务则要求控制库存。表面看是库存、采购和投放互相冲突，往上看一层，当前主要矛盾是订单增长节奏已经超过了团队的SKU分层、补货纪律和现金周转能力。",
    "goal": "60天内稳定热销款供应，同时把库存现金压力降到可控范围。",
    "deadline": "60天",
    "success_metric": "A类SKU断货率低于8%；库存周转天数下降20%；低动销库存占比下降15%；经营现金流转正或接近转正。",
    "stage": "增长期中的库存修复期",
    "resources": [
      "20个核心SKU、约180个颜色尺码组合",
      "现有仓库库存和近90天销售数据",
      "每周投放预算约20万元",
      "采购、运营、财务和投放团队"
    ],
    "constraints": [
      "不能大幅增加采购现金占用",
      "热销款断货会直接影响GMV和平台权重",
      "旧款清仓过猛会伤害品牌价格体系",
      "供应链补货周期约21到35天"
    ],
    "stakeholders": [
      "品牌负责人",
      "采购负责人",
      "电商运营",
      "投放负责人",
      "财务负责人",
      "仓储团队",
      "消费者"
    ],
    "previous_attempts": [
      "热销款断货后临时加急补货，但到货时流量峰值已经过去。",
      "做过几次清仓活动，但低动销库存结构没有明显改善。",
      "投放按GMV目标继续加预算，带来更多补货压力和退换货压力。"
    ],
    "recurring_patterns": [
      "爆款缺货时紧急采购，冷门款却持续占用现金。",
      "采购、投放和财务分别看自己的指标，缺少SKU级别的共同看板。",
      "每次大促前都靠经验备货，大促后再处理库存积压。"
    ]
  },
  "facts": [
    {"text": "最近两个月GMV增长约70%。", "source_type": "estimated"},
    {"text": "热销款经常断货，旧款和低动销尺码占用库存。", "source_type": "observed"},
    {"text": "供应链补货周期约21到35天。", "source_type": "estimated"},
    {"text": "SKU级别的现金占用、毛利和动销看板尚未统一。", "source_type": "assumed"}
  ],
  "analysis_logic": {
    "method_note": "这个案例不能只看GMV增长或库存积压，而要看哪一个矛盾同时解释断货、现金紧、清仓难和投放争议。",
    "first_principles_question": "如果只能改变一个经营机制，改变什么能让增长不再吞噬现金？",
    "higher_level_logic": "上升一层看，热销款断货和旧款积压是同一个系统问题的两面：团队还没有用SKU分层和现金周转来约束采购、投放和清仓。",
    "visible_problems": [
      "看得见的问题：GMV增长，但现金流更紧。",
      "看得见的问题：热销SKU断货，错过流量窗口。",
      "看得见的问题：旧款和低动销尺码占用库存。",
      "看得见的问题：采购、投放和财务互相拉扯。"
    ],
    "hidden_root_variables": [
      "看不见的根部变量：SKU分层、补货纪律和现金周转没有成为统一决策规则。",
      "看不见的根部变量：投放预算没有和可售库存、毛利和补货周期联动。",
      "看不见的根部变量：清仓、补货和上新没有在同一张经营账上取舍。"
    ],
    "why_not_surface": "如果只继续加投放，可能放大断货和现金压力；如果只清库存，可能牺牲热销增长。当前要先建立SKU分层和现金周转规则，让采购和投放都围绕同一套经营约束行动。",
    "ranking_rule": "排序时看哪个矛盾最能同时影响GMV、现金、库存和团队协作。库存现金周转失衡比单独补货或清仓更上游。",
    "decisiveness": "决定性：库存现金周转不稳，GMV增长越快越可能占用现金并制造断货与积压。",
    "leverage": "牵引性：SKU分层和现金周转规则建立后，补货、投放、清仓和财务取舍会同时变清楚。",
    "stage_fit": "阶段性：当前60天的核心不是继续追GMV，而是把增长控制在现金和库存纪律内。",
    "internal_changeable": [
      "SKU分层、补货纪律和停止补货清单",
      "投放预算与可售库存、安全库存和毛利联动",
      "低动销库存的渠道分流和现金回收节奏"
    ],
    "external_conditions": [
      "供应链补货周期约21到35天",
      "平台流量窗口短，断货会浪费投放",
      "价格体系和品牌形象限制一刀切清仓"
    ],
    "external_through_internal": "供应链周期和平台流量窗口会通过SKU分层、补货纪律和投放联动影响现金结果；内部经营规则越粗，外部波动越容易放大成现金压力。"
  },
  "visuals": {
    "summary": "这组图把热销断货、旧款积压和现金紧张连接到SKU分层和现金周转这条主线。",
    "charts": [
      {"type": "analysis_flow", "title": "分析流程图"},
      {"type": "iceberg", "title": "冰山模型"},
      {"type": "decision_matrix", "title": "矛盾候选决策矩阵"},
      {"type": "resource_allocation", "title": "资源倾斜图"},
      {"type": "stage_transition", "title": "动态阶段迁移图"}
    ]
  },
  "resource_allocation": {
    "title": "经营资源倾斜",
    "unit": "%",
    "aggressiveness": "aggressive",
    "main_focus_share": 65,
    "secondary_cap_share": 20,
    "monitoring_share": 15,
    "note": "采用激进倾斜：把65%的经营注意力放到SKU分层、A类保障、低动销处理和现金周转，压缩无差别补货与单纯追GMV。",
    "items": [
      {"label": "无差别补货", "current": 35, "recommended": 5},
      {"label": "追GMV投放", "current": 30, "recommended": 10},
      {"label": "A类保障", "current": 15, "recommended": 35},
      {"label": "低动销处理", "current": 10, "recommended": 30},
      {"label": "现金看板", "current": 10, "recommended": 20}
    ]
  },
  "stage_transition": {
    "title": "主要矛盾动态转移",
    "note": "当前先控制库存现金周转；一旦SKU分层稳定，主要矛盾可能转向产品企划、供应链柔性或品牌价格体系。",
    "stages": [
      {"stage": "当前60天", "principal": "订单增长 与 库存现金周转失衡的冲突", "trigger": "增长越快，现金和库存压力越大。"},
      {"stage": "周转改善后", "principal": "产品企划节奏 与 市场需求变化的冲突", "trigger": "库存可控后，新品命中率成为增长瓶颈。"},
      {"stage": "供应稳定后", "principal": "快速补货需求 与 供应链柔性不足的冲突", "trigger": "A类SKU预测准，但补货周期仍拖慢增长。"},
      {"stage": "品牌升级期", "principal": "清仓效率 与 品牌价格体系的冲突", "trigger": "低动销下降后，价格稳定成为核心问题。"}
    ]
  },
  "contradictions": [
    {
      "id": "c1",
      "name": "订单增长 与 库存现金周转失衡的冲突",
      "type": "resource",
      "evidence": ["GMV增长但现金更紧", "热销断货和低动销积压同时存在", "采购、投放和财务缺少SKU级共同规则"],
      "scores": {"goal_impact": 5, "causal_leverage": 5, "stage_urgency": 5, "resource_constraint": 5, "changeability": 4, "spillover_risk": 5, "evidence_strength": 4},
      "principal_aspect": "库存现金周转失衡当前占支配地位",
      "why_principal": "当前不是单纯卖得不够，也不是单纯库存太多，而是增长没有被SKU分层、补货纪律和现金周转约束住。这个矛盾不解决，GMV越高越可能吞噬现金。",
      "reversal_condition": "如果A类SKU断货率下降、低动销库存下降，但利润仍没有改善，主要矛盾可能转向价格体系、毛利结构或产品企划能力。"
    },
    {
      "id": "c2",
      "name": "热销款需求 与 补货周期滞后的冲突",
      "type": "process",
      "evidence": ["热销款断货", "补货周期21到35天", "加急补货经常错过流量峰值"],
      "scores": {"goal_impact": 4, "causal_leverage": 4, "stage_urgency": 5, "resource_constraint": 4, "changeability": 3, "spillover_risk": 4, "evidence_strength": 4},
      "defer_reason": "它很重要，但要在SKU分层后优先保障A类SKU，否则补货资源仍会被分散。",
      "monitor_trigger": "如果A类SKU已明确但仍断货率超过10%，就升级补货机制。"
    },
    {
      "id": "c3",
      "name": "低动销库存 与 现金回收需求的冲突",
      "type": "resource",
      "evidence": ["旧款和低动销尺码占用现金", "清仓不能过度伤害价格体系"],
      "scores": {"goal_impact": 4, "causal_leverage": 4, "stage_urgency": 4, "resource_constraint": 5, "changeability": 4, "spillover_risk": 4, "evidence_strength": 4},
      "defer_reason": "需要马上处理，但它要和A类补货放在同一张现金周转表里统一取舍。",
      "monitor_trigger": "如果低动销库存占比两周内没有下降，就要加大清仓或渠道分流。"
    },
    {
      "id": "c4",
      "name": "投放增长目标 与 可售库存约束的冲突",
      "type": "goal",
      "evidence": ["投放团队希望继续加预算", "热销SKU断货会浪费流量"],
      "scores": {"goal_impact": 4, "causal_leverage": 3, "stage_urgency": 4, "resource_constraint": 4, "changeability": 4, "spillover_risk": 4, "evidence_strength": 3},
      "defer_reason": "投放规则要跟随库存分层调整，不宜单独追求GMV。",
      "monitor_trigger": "如果投放仍把预算打到库存不足SKU上，就升级投放治理。"
    },
    {
      "id": "c5",
      "name": "新品上新节奏 与 历史库存消化的冲突",
      "type": "stage",
      "evidence": ["上新会带来增长，但旧款占用现金", "清仓过猛会伤害品牌"],
      "scores": {"goal_impact": 3, "causal_leverage": 3, "stage_urgency": 3, "resource_constraint": 4, "changeability": 3, "spillover_risk": 3, "evidence_strength": 3},
      "defer_reason": "当前先稳住周转和现金，再处理上新节奏。",
      "monitor_trigger": "如果现金压力下降但新品命中率低，再升级产品企划问题。"
    }
  ],
  "actions": [
    {
      "action": "7天内按销售额、毛利、库存天数把SKU分成A/B/C/D四类，并暂停D类补货。",
      "owner": "运营负责人 + 财务负责人",
      "deadline": "7天",
      "resource": "近90天销售数据、库存表、毛利表",
      "metric": "形成SKU分层表和D类停止补货清单。",
      "principal_aspect_shift": "先把库存现金周转失衡拆到SKU层，削弱无差别补货对局面的支配。",
      "completion_probability": 0.85,
      "estimated_uplift": 0.09,
      "dependency_discount": 0.9
    },
    {
      "action": "14天内建立A类SKU补货和投放联动规则，库存低于安全线时自动调低投放。",
      "owner": "采购负责人 + 投放负责人",
      "deadline": "14天",
      "resource": "库存预警线、投放计划、供应商交期",
      "metric": "A类SKU断货率低于8%，投放预算不再打到断货SKU。",
      "principal_aspect_shift": "把投放和补货绑定到A类库存纪律，增强增长侧对现金周转的约束。",
      "completion_probability": 0.72,
      "estimated_uplift": 0.15,
      "dependency_discount": 0.85
    },
    {
      "action": "30天内执行低动销库存分层处理：换购、渠道分流、组合包和小幅清仓，避免一刀切打折。",
      "owner": "电商运营 + 财务",
      "deadline": "30天",
      "resource": "低动销清单、渠道资源、促销权益",
      "metric": "低动销库存占比下降15%，库存周转天数下降20%。",
      "principal_aspect_shift": "用分层处理释放现金，降低库存现金周转失衡的主导性。",
      "completion_probability": 0.68,
      "estimated_uplift": 0.18,
      "dependency_discount": 0.8
    }
  ],
  "projection": {
    "baseline_success_probability": 0.28,
    "risk_drag": [
      {"risk": "采购仍按经验补货，不执行SKU分层", "probability": 0.25, "impact": 0.08},
      {"risk": "清仓过猛伤害品牌价格体系", "probability": 0.22, "impact": 0.07}
    ],
    "sensitivity_notes": [
      "如果A类SKU断货率仍高于10%，建议下调行动后概率。",
      "如果低动销库存下降但毛利明显恶化，需要重新平衡清仓策略。",
      "如果供应商交期缩短到14天以内，可以上调增长恢复概率。"
    ]
  },
  "review": {
    "review_time": "7天看SKU分层，30天看库存周转，60天看现金流。",
    "review_conditions": [
      "A类SKU断货率低于8%。",
      "低动销库存占比下降15%。",
      "库存周转天数下降20%。",
      "投放ROI明显下降或现金流继续恶化。"
    ],
    "evidence_to_collect": [
      "SKU分层表",
      "库存周转天数",
      "A类SKU断货率",
      "低动销库存占比",
      "投放预算与可售库存匹配度"
    ]
  },
  "warnings": [
    "本报告为虚构业务示例，仅用于展示skill输出效果。",
    "概率为结构化估算，不代表真实经营承诺。"
  ]
}
